{
  "format":"save-one-stroke-level",
  "version":2,
  "id":10,
  "chapter":"变种",
  "title":"支点也下班",
  "tag":"新规则 · 地面会撤走",
  "brief":"开局看着挺稳？橙色踏板只负责前半场。",
  "condition":"2.2 秒后橙色临时踏板会真的撤走。让支撑连到永久地面，不能只看开局。",
  "quip":"踏板下班了，我还得坐着。",
  "success":"临时工走了，永久方案接上了。",
  "failure":"我以为它说下班，只是说说。",
  "ink":190,
  "gold":160,
  "chair":[{"x":234,"y":251,"w":184,"h":18,"kind":"seat"},{"x":247,"y":265,"w":14,"h":135,"kind":"leg"},{"x":389,"y":265,"w":14,"h":135,"kind":"leg"}],
  "terrain":[{"x":20,"y":400,"w":174,"h":90},{"x":345,"y":400,"w":355,"h":90},{"x":229,"y":400,"w":57,"h":36}],
  "load":{"x":341,"mass":14},
  "mechanics":{"temporaryTerrain":[{"index":2,"removeAt":2200,"label":"临时踏板"}]},
  "hint":["先把橙色那一块当作不存在：剩下哪一边会缺支撑？", "左侧旧腿可以接出一条斜撑，落到更左边的永久地面。也可以从旧腿中途起笔省墨。"],
  "labels":[{"x":59,"y":311,"text":"这边不会下班","to":[175,396]}]
}
