{
  "format":"save-one-stroke-level",
  "version":2,
  "id":12,
  "chapter":"变种",
  "title":"地板拐弯了",
  "tag":"新规则 · 重力向右转",
  "brief":"不是一阵风，是整个世界换了一个下方。",
  "condition":"2.0 秒后重力改为向右，右墙变成新的承重面。椅面仍须保持水平；上方画区开放。",
  "quip":"物理老师，这题能申请复核吗？",
  "success":"换了一个下方，你也没把我放倒。",
  "failure":"腿还是朝下，但下已经跑到右边了。",
  "ink":450,
  "gold":405,
  "chair":[{"x":234,"y":251,"w":184,"h":18,"kind":"seat"},{"x":247,"y":265,"w":14,"h":135,"kind":"leg"},{"x":389,"y":265,"w":14,"h":135,"kind":"leg"}],
  "terrain":[{"x":20,"y":400,"w":680,"h":90},{"x":600,"y":100,"w":28,"h":300}],
  "load":{"x":341,"mass":14},
  "mechanics":{"drawTop":140,"gravity":[{"at":0,"x":0,"y":1,"label":"重力向下 ↓"},{"at":2000,"x":1,"y":0,"label":"重力向右 →"}]},
  "hint":["原来的两只脚管前两秒。换向后，横着伸出一根细杆也可能绕接触点翻转。", "把右墙当地板，给它上下两个接触点：从墙的上部经椅面，再伸回墙的下部，像横躺的帐篷。"],
  "labels":[{"x":480,"y":357,"text":"新地板在右边","to":[594,311]}]
}
