{
  "format":"save-one-stroke-level",
  "version":2,
  "id":13,
  "chapter":"变种",
  "title":"别只会补腿",
  "tag":"新规则 · 真球会滚动碰撞",
  "brief":"这次笔只能修椅面以上。别急着接住一切。",
  "condition":"0.9 秒后保龄球落下。只能在亮色上方画区施工；球可以导开，不必接住，出生圈不能画。",
  "quip":"这是试坐，不是保龄球赛啊。",
  "success":"球去别处团建了，工位保住了。",
  "failure":"接住了球，也接住了它全部的重量。",
  "ink":330,
  "gold":295,
  "chair":[{"x":234,"y":251,"w":202,"h":18,"kind":"seat"},{"x":247,"y":265,"w":14,"h":135,"kind":"leg"},{"x":345,"y":265,"w":14,"h":135,"kind":"leg"}],
  "terrain":[{"x":20,"y":400,"w":680,"h":90}],
  "load":{"x":341,"mass":14},
  "mechanics":{"drawTop":60,"drawBottom":280,"drops":[{"at":900,"x":427,"y":74,"radius":22,"mass":10,"label":"保龄球"}]},
  "hint":["平顶会把球留下，重量偏在右侧。想想有没有办法让它继续离开，而不是留在头顶。", "从椅面右侧接出一块向右下方倾斜的屋顶，给球一条滚出去的路；斜面要在出生圈下方。"],
  "labels":[{"x":503,"y":222,"text":"挡开，也是一种救法","to":[485,149]}]
}
