{
  "format":"save-one-stroke-level",
  "version":2,
  "id":11,
  "chapter":"变种",
  "title":"借个天花板",
  "tag":"新规则 · 金环可以挂接",
  "brief":"谁说椅子一定要长腿？这回试着向上借力。",
  "condition":"上方画区开放。笔画碰金环就铰接到墙上；挂点能转动，不会把椅子锁死。",
  "quip":"工位可以悬，心态不能悬。",
  "success":"不用落地也稳了，这次是真的有靠山。",
  "failure":"挂住了，不代表不会晃过去。",
  "ink":500,
  "gold":450,
  "chair":[{"x":234,"y":251,"w":184,"h":18,"kind":"seat"}],
  "terrain":[{"x":20,"y":400,"w":120,"h":90},{"x":580,"y":400,"w":120,"h":90}],
  "load":{"x":341,"mass":14},
  "mechanics":{"drawTop":80,"anchors":[{"x":270,"y":130,"radius":10,"label":"左墙挂点"},{"x":440,"y":130,"radius":10,"label":"右墙挂点"}]},
  "hint":["一个挂点像秋千的转轴。重心偏在一边时，整把椅子会往哪转？", "一笔从一侧金环经过木椅，再接到另一侧金环；两个分开的挂点就能限制转动。"],
  "labels":[{"x":462,"y":315,"text":"这次没有近处地板","to":[460,401]}]
}
